<?xml version="1.0" encoding="UTF-8"?>
<predictions xmlns="https://www.playitaCorra.com/"
             xmlns:xsi="http://www.w3.org/2001/XMLSchema-instance"
             xsi:schemaLocation="https://www.playitaCorra.com/ XmlSchema_playita.xsd">
    <prediction>
        <day>20200403</day>
        <sky_state>
            <f1>120</f1>
            <descripcion1>muy nuboso</descripcion1>
            <f2>100</f2>
            <descripcion2>despejado</descripcion2>
        </sky_state>
        <wind>
            <f1>210</f1>
            <descripcion1>flojo</descripcion1>
            <f2>210</f2>
            <descripcion2>flojo</descripcion2>
        </wind>
        <surge>
            <f1>310</f1>
            <descripcion1>débil</descripcion1>
            <f2>310</f2>
            <descripcion2>débil</descripcion2>
        </surge>
        <t_max>21</t_max>
        <s_thermal>
            <f1>310</f1>
            <descripcion1>suave</descripcion1>
        </s_thermal>
        <t_water>20</t_water>
        <uv_max>8</uv_max>
    </prediction>
    <prediction>
        <day>20200404</day>
        <sky_state>
            <f1>120</f1>
            <descripcion1>muy nuboso</descripcion1>
            <f2>110</f2>
            <descripcion2>nuboso</descripcion2>
        </sky_state>
        <wind>
            <f1>210</f1>
            <descripcion1>flojo</descripcion1>
            <f2>210</f2>
            <descripcion2>flojo</descripcion2>
        </wind>
        <surge>
            <f1>310</f1>
            <descripcion1>débil</descripcion1>
            <f2>310</f2>
            <descripcion2>débil</descripcion2>
        </surge>
        <t_max>23</t_max>
        <s_thermal>
            <f1>310</f1>
            <descripcion1>suave</descripcion1>
        </s_thermal>
        <t_water>19</t_water>
        <uv_max>8</uv_max>
    </prediction>
    <prediction>
        <day>20200405</day>
        <sky_state>
            <f1>120</f1>
            <descripcion1>muy nuboso</descripcion1>
            <f2>120</f2>
            <descripcion2>muy nuboso</descripcion2>
        </sky_state>
        <wind>
            <f1>210</f1>
            <descripcion1>flojo</descripcion1>
            <f2>220</f2>
            <descripcion2>moderado</descripcion2>
        </wind>
        <surge>
            <f1>310</f1>
            <descripcion1>débil</descripcion1>
            <f2>310</f2>
            <descripcion2>débil</descripcion2>
        </surge>
        <t_max>23</t_max>
        <s_thermal>
            <f1>310</f1>
            <descripcion1>suave</descripcion1>
        </s_thermal>
        <t_water>20</t_water>
        <uv_max>9</uv_max>
    </prediction>
</predictions>